,title,contents
479,"[자원개발 테마주-마감] 엔케이물산,GS 등이 상승세 견인중","12월 17일 화요일 자원개발 테마주 종가를 알아본다. 이 날 자원개발주를 견인한 것은 엔케이물산 종목이다. 엔케이물산은 주당 1,450원의 거래가격으로 전일대비+23.40%의 등락률을 기록 자원개발테마주를..."
480,"이낙연·정세균·추미애 '정치 테마주 기승'… ""수십억 차익 실현?""",[사진=연합뉴스] 최근 정치 테마주가 기승을 부리고 있다. 뚜렷한 실적이나 성장성 없이 정치인 이슈에 따라 주가 급등락을 반복하는 모습이다. 정치 테마주의 경우 단순히 기대감에 의한 심리 싸움이기 때문에 투자가...
481,"[19일 13시 아프리카 돼지열병(ASF) 테마주 오후 시황] 코미팜,고려시멘트 등...","12월 19일 목요일 이시간 현재 아프리카 돼지열병(ASF) 테마주, 관련 현황을 알아본다. 13시 29분 현재... 코미팜은 주당 14,550원의 거래가격으로 전일대비+4.68%의 등락률을 기록 아프리카 돼지열병(ASF)테마주를..."
482,"[19일 09시 보안주(정보) 테마주 시황-오전] 한류AI센터,휴네시온 등이 주도....","(정보) 테마주, 관련 현황을 알아본다. 09시 15분 현재 보안주(정보)주를 견인하고 있는 것은 한류AI센터 종목이다. 한류AI센터는 주당 1,455원의 거래가격으로 전일대비+11.07%의 등락률을 기록 보안주(정보)테마주..."
483,"[20일 13시 환율하락 수혜 테마주 시황-오후] 오리온,모두투어 등이 상승세 견...","수혜 테마주, 관련 현황을 알아본다. 13시 29분 현재 환율하락 수혜주를 견인하고 있는 것은 오리온 종목이다. 오리온은 주당 107,500원의 거래가격으로 전일대비+4.37%의 등락률을 기록 환율하락 수혜테마주를..."
484,"[13시 23분 주류업 오후 테마시황] 보해양조,롯데칠성 등이 주도...","주류업 테마주, 관련 현황을 알아본다. 13시 23분 현재 주류업주를 견인하고 있는 것은 보해양조 종목이다. 보해양조는 주당 1,090원의 거래가격으로 전일대비+8.46%의 등락률을 기록 주류업테마주를 주도하고 있는..."
485,"[터치패널(스마트폰/태블릿PC) 테마주-마감] 파인텍,베셀 등이 상승세 주도","테마주 종가를 알아본다. 이 날 터치패널(스마트폰/태블릿PC)주를 견인한 것은 파인텍 종목이다. 파인텍은 주당 2,200원의 거래가격으로 전일대비+9.18%의 등락률을 기록 터치패널(스마트폰/태블릿PC)테마주를..."
486,"[13시 27분 공기청정기 테마주 시황-오후] 삼성전자,에스피지 등이 주도...","공기청정기 테마주, 관련 현황을 알아본다. 13시 27분 현재 공기청정기주를 견인하고 있는 것은 삼성전자 종목이다. 삼성전자는 주당 56,300원의 거래가격으로 전일대비+2.93%의 등락률을 기록 공기청정기테마주를..."
487,"[17일 13시 태양광에너지 테마주 오후 시황] 티씨케이,유니테스트 등이 상승세...","테마주, 관련 현황을 알아본다. 13시 26분 현재 태양광에너지주를 견인하고 있는 것은 티씨케이 종목이다. 티씨케이는 주당 62,800원의 거래가격으로 전일대비+9.79%의 등락률을 기록 태양광에너지테마주를..."
488,"[18일 13시 영상콘텐츠 테마주 시황-오후] 큐로홀딩스,이에스에이 등이 상승세...","테마주, 관련 현황을 알아본다. 13시 24분 현재 영상콘텐츠주를 견인하고 있는 것은 큐로홀딩스 종목이다. 큐로홀딩스는 주당 1,100원의 거래가격으로 전일대비+18.53%의 등락률을 기록 영상콘텐츠테마주를..."
489,"[창투사 테마주-마감] SV인베스트먼트,대성창투 등이 주도...","12월 16일 월요일 창투사 테마주 종가를 알아본다. 이 날 창투사주를 견인한 것은 SV인베스트먼트 종목이다. SV인베스트먼트는 주당 2,030원의 거래가격으로 전일대비+9.73%의 등락률을 기록 창투사테마주를 주도한..."
490,"[통신장비 테마주-마감] 에이스테크,서진시스템 등이 상승세 주도","12월 16일 월요일 통신장비 테마주 종가를 알아본다. 이 날 통신장비주를 견인한 것은 에이스테크 종목이다. 에이스테크는 주당 7,680원의 거래가격으로 전일대비+6.22%의 등락률을 기록 통신장비테마주를 주도한..."
491,"[13시 22분 반도체 장비 테마주 오후 시황] 티씨케이,케이씨텍 등이 상승세 견...","장비 테마주, 관련 현황을 알아본다. 13시 22분 현재 반도체 장비주를 견인하고 있는 것은 티씨케이 종목이다. 티씨케이는 주당 62,800원의 거래가격으로 전일대비+9.79%의 등락률을 기록 반도체 장비테마주를..."
492,"[09시 14분 MLCC(적층세라믹콘덴서) 테마주 오전 시황] 삼화콘덴서,대주전자재...","12월 19일 목요일 이시간 현재 MLCC(적층세라믹콘덴서) 테마주, 관련 현황을 알아본다. 09시 14분 현재 MLCC... 45%의 등락률을 기록 MLCC(적층세라믹콘덴서)테마주를 주도하고 있는 것으로 알려졌다. 코스피상장기업인..."
493,"[18일 13시 시스템반도체 테마주 시황-오후] 에이디테크놀로지,하나마이크론 ...","12월 18일 수요일 이시간 현재 시스템반도체 테마주, 관련 현황을 알아본다. 13시 22분 현재... 에이디테크놀로지는 주당 14,550원의 거래가격으로 전일대비+23.31%의 등락률을 기록 시스템반도체테마주를 주도하고..."
494,[특징주]남선알미늄 등 이낙연 테마주 촐선 출마 기대에 '급등',문재인 대통령이 차기 국무총리 후보자로 정세균 전 국회의장을 지명하면서 이낙연 현 총리 테마주가 동반 급등세다. 내년 총선 출마 기대가 반영된 것으로 보인다. 18일 오전 10시16분 현재 남선알미늄은 전일 대비 17.28...
495,"[반도체 재료/부품 테마주 시황-마감] 마이크로컨텍솔,하나마이크론 등이 상승...","재료/부품 테마주 종가를 알아본다. 이 날 반도체 재료/부품주를 견인한 것은 마이크로컨텍솔 종목이다. 마이크로컨텍솔은 주당 4,310원의 거래가격으로 전일대비+13.87%의 등락률을 기록 반도체 재료/부품테마주를..."
496,"[18일 13시 항공/저가 항공사(LCC) 테마주 오후 시황] 제주항공,티웨이항공 등...","12월 18일 수요일 이시간 현재 항공/저가 항공사(LCC) 테마주, 관련 현황을 알아본다. 13시 22분 현재 항공... 제주항공은 주당 28,500원의 거래가격으로 전일대비+10.68%의 등락률을 기록 항공/저가 항공사(LCC)테마주를..."
497,"[24일 13시 건설 중소형 오후의 테마종목] 삼호,남화토건 등이 상승세 견인중","중소형 테마주, 관련 현황을 알아본다. 13시 24분 현재 건설 중소형주를 견인하고 있는 것은 삼호 종목이다. 삼호는 주당 21,000원의 거래가격으로 전일대비+11.70%의 등락률을 기록 건설 중소형테마주를 주도하고..."
498,"[20일 09시 보안주(정보) 테마주 시황-오전] 퓨전,한류AI센터 등이 상승세 견...","(정보) 테마주, 관련 현황을 알아본다. 09시 12분 현재 보안주(정보)주를 견인하고 있는 것은 퓨전 종목이다. 퓨전은 주당 6,810원의 거래가격으로 전일대비+11.64%의 등락률을 기록 보안주(정보)테마주를 주도하고..."
499,"[기업인수목적회사(SPAC) 테마 마감시황] 유안타제3호스팩,신영스팩4호 등이 ...",12월 24일 화요일 기업인수목적회사(SPAC) 테마주 종가를 알아본다. 이 날 기업인수목적회사(SPAC)주를... 98%의 등락률을 기록 기업인수목적회사(SPAC)테마주를 주도한 것으로 알려졌다. 코스닥상장기업인...
500,"[16일 13시 시스템반도체 테마주 시황-오후] SFA반도체,에스앤에스텍 등이 주...","테마주, 관련 현황을 알아본다. 13시 22분 현재 시스템반도체주를 견인하고 있는 것은 SFA반도체 종목이다. SFA반도체는 주당 4,080원의 거래가격으로 전일대비+14.93%의 등락률을 기록 시스템반도체테마주를..."
501,"[24일 09시 일자리(취업) 오전 테마시황] 윌비스,DSC인베스트먼트 등이 상승세...","(취업) 테마주, 관련 현황을 알아본다. 09시 16분 현재 일자리(취업)주를 견인하고 있는 것은 윌비스 종목이다. 윌비스는 주당 1,360원의 거래가격으로 전일대비+2.26%의 등락률을 기록 일자리(취업)테마주를..."
502,"[24일 09시 영화 오전의 테마종목] 바른손,덱스터 등이 상승세 견인중","영화 테마주, 관련 현황을 알아본다. 09시 16분 현재 영화주를 견인하고 있는 것은 바른손 종목이다. 바른손은 주당 2,065원의 거래가격으로 전일대비+3.77%의 등락률을 기록 영화테마주를 주도하고 있는..."
503,"[09시 17분 남-북-러 가스관사업 오전 테마시황] 엔케이,조광ILI 등이 주도","테마주, 관련 현황을 알아본다. 09시 17분 현재 남-북-러 가스관사업주를 견인하고 있는 것은 엔케이 종목이다. 엔케이는 주당 1,170원의 거래가격으로 전일대비+1.74%의 등락률을 기록 남-북-러 가스관사업테마주를..."
504,"[09시 12분 캐릭터상품 오전 테마시황] 캐리소프트,대원미디어 등이 주도","캐릭터상품 테마주, 관련 현황을 알아본다. 09시 12분 현재 캐릭터상품주를 견인하고 있는 것은 캐리소프트 종목이다. 캐리소프트는 주당 8,260원의 거래가격으로 전일대비+7.55%의 등락률을 기록 캐릭터상품테마주..."
505,"[SSD 테마주 시황-마감] SK하이닉스,삼성전자 등이 상승세 견인중","12월 17일 화요일 SSD 테마주 종가를 알아본다. 이 날 SSD주를 견인한 것은 SK하이닉스 종목이다. SK하이닉스는 주당 92,800원의 거래가격으로 전일대비+4.74%의 등락률을 기록 SSD테마주를 주도한 것으로..."
506,"[은행 테마종목 종가] KB금융,우리금융지주 등이 주도...","12월 23일 월요일 은행 테마주 종가를 알아본다. 이 날 은행주를 견인한 것은 KB금융 종목이다. KB금융은 주당 49,900원의 거래가격으로 전일대비+1.73%의 등락률을 기록 은행테마주를 주도한 것으로 알려졌다...."
507,"[LCD 부품/소재 테마주-마감] 와이엠씨,동진쎄미켐 등이 상승세 견인중","12월 17일 화요일 LCD 부품/소재 테마주 종가를 알아본다. 이 날 LCD 부품/소재주를 견인한 것은 와이엠씨 종목이다. 와이엠씨는 주당 5,790원의 거래가격으로 전일대비+9.25%의 등락률을 기록 LCD 부품/소재테마주를..."
508,"[SNS(소셜네트워크서비스) 테마주 시황-마감] 갤럭시아컴즈,필링크 등이 주도","테마주 종가를 알아본다. 이 날 SNS(소셜네트워크서비스)주를 견인한 것은 갤럭시아컴즈 종목이다. 갤럭시아컴즈는 주당 3,440원의 거래가격으로 전일대비+9.90%의 등락률을 기록 SNS(소셜네트워크서비스)테마주를..."
509,"[17일 13시 반도체 재료/부품 테마주 오후 시황] 케이엔제이,티씨케이 등이 상...","12월 17일 화요일 이시간 현재 반도체 재료/부품 테마주, 관련 현황을 알아본다. 13시 22분 현재 반도체... 케이엔제이는 주당 11,200원의 거래가격으로 전일대비+9.80%의 등락률을 기록 반도체 재료/부품테마주를..."
510,"[17일 13시 반도체 재료/부품 테마주 오후 시황] 케이엔제이,티씨케이 등이 상...","12월 17일 화요일 이시간 현재 반도체 재료/부품 테마주, 관련 현황을 알아본다. 13시 22분 현재 반도체... 케이엔제이는 주당 11,200원의 거래가격으로 전일대비+9.80%의 등락률을 기록 반도체 재료/부품테마주를..."
511,"[13시 24분 LCD장비 테마주 시황-오후] 케이엔제이,케이씨텍 등이 주도","LCD장비 테마주, 관련 현황을 알아본다. 13시 24분 현재 LCD장비주를 견인하고 있는 것은 케이엔제이 종목이다. 케이엔제이는 주당 11,200원의 거래가격으로 전일대비+9.80%의 등락률을 기록 LCD장비테마주를..."
512,"[음식료업종 테마종목 종가] 한국맥널티,오뚜기 등이 주도...","12월 23일 월요일 음식료업종 테마주 종가를 알아본다. 이 날 음식료업종주를 견인한 것은 한국맥널티 종목이다. 한국맥널티는 주당 7,000원의 거래가격으로 전일대비+22.16%의 등락률을 기록 음식료업종테마주를..."
513,올해 주식시장서 ‘개인투자자’만 잃었다,이 같은 수익률 차이는 개인 투자자들의 투자가 테마주 중심으로 이뤄졌기 때문으로 풀이됩니다. 실제로... 테마주 중심의 투자로 순손실을 기록한 개인투자자들.한 증권업계 관계자는 “최근 상장폐지를 앞두고...
514,"[18일 13시 통신장비 테마주 시황-오후] 이노와이어리스,루멘스 등이 상승세 ...","테마주, 관련 현황을 알아본다. 13시 29분 현재 통신장비주를 견인하고 있는 것은 이노와이어리스 종목이다. 이노와이어리스는 주당 30,850원의 거래가격으로 전일대비+7.30%의 등락률을 기록 통신장비테마주를..."
515,"[19일 09시 日 수출 규제 관련주(국산화 등) 테마주 오전 시황] 동진쎄미켐,솔...","12월 19일 목요일 이시간 현재 日 수출 규제 관련주(국산화 등) 테마주, 관련 현황을 알아본다. 09시 18분... 69%의 등락률을 기록 日 수출 규제 관련주(국산화 등)테마주를 주도하고 있는 것으로 알려졌다...."
516,"[19일 13시 보안주(정보) 테마주 시황-오후] 한류AI센터,한컴위드 등이 상승세...","(정보) 테마주, 관련 현황을 알아본다. 13시 28분 현재 보안주(정보)주를 견인하고 있는 것은 한류AI센터 종목이다. 한류AI센터는 주당 1,550원의 거래가격으로 전일대비+18.32%의 등락률을 기록 보안주(정보)테마주..."
517,"[13시 26분 생명보험 테마주 시황-오후] 오렌지라이프,동양생명 등이 주도","생명보험 테마주, 관련 현황을 알아본다. 13시 26분 현재 생명보험주를 견인하고 있는 것은 오렌지라이프 종목이다. 오렌지라이프는 주당 29,350원의 거래가격으로 전일대비+2.09%의 등락률을 기록 생명보험테마주..."
518,"[스포츠행사 수혜(올림픽, 월드컵 등) 테마주 시황-마감] 하이트진로,하이트진...","12월 18일 수요일 스포츠행사 수혜(올림픽, 월드컵 등) 테마주 종가를 알아본다. 이 날 스포츠행사 수혜... 51%의 등락률을 기록 스포츠행사 수혜(올림픽, 월드컵 등)테마주를 주도한 것으로 알려졌다...."
519,[급등락주 짚어보기] ‘이낙연 테마주’ 주연테크ㆍ중앙에너비스 상한가,이날도 소위 이낙연 국무총리 테마주가 강세를 보였다. 주연테크는 전 거래일보다 29.92% 오른 773원에... 중앙에너비스는 김병재 사외이사가 이 총리와 서울대 법대 동기로 알려지면서 테마주로 묶였다. 앞서 차기...
520,"[20일 09시 무선충전기술 테마주 오전 시황] 한솔테크닉스,이랜텍 등이 상승세...","테마주, 관련 현황을 알아본다. 09시 13분 현재 무선충전기술주를 견인하고 있는 것은 한솔테크닉스 종목이다. 한솔테크닉스는 주당 8,920원의 거래가격으로 전일대비+1.71%의 등락률을 기록 무선충전기술테마주를..."
521,"[13시 26분 보안주(물리) 테마주 오후 시황] 아이디스,인콘 등이 상승세 주도","(물리) 테마주, 관련 현황을 알아본다. 13시 26분 현재 보안주(물리)주를 견인하고 있는 것은 아이디스 종목이다. 아이디스는 주당 32,900원의 거래가격으로 전일대비+5.62%의 등락률을 기록 보안주(물리)테마주를..."
522,"[무선충전기술 테마주-마감] 이랜텍,켐트로닉스 등이 상승세 견인중","12월 17일 화요일 무선충전기술 테마주 종가를 알아본다. 이 날 무선충전기술주를 견인한 것은 이랜텍 종목이다. 이랜텍은 주당 6,170원의 거래가격으로 전일대비+7.30%의 등락률을 기록 무선충전기술테마주를..."
523,"[11시 06분 케이블TV SO/MSO 테마주 오전 시황] CJ헬로,KMH 등이 상승세 주도","SO/MSO 테마주, 관련 현황을 알아본다. 11시 06분 현재 케이블TV SO/MSO주를 견인하고 있는 것은 CJ헬로 종목이다. CJ헬로는 주당 6,380원의 거래가격으로 전일대비+5.98%의 등락률을 기록 케이블TV SO/MSO테마주를..."
524,"[겨울관련주 테마종목 종가] 신일산업,한미약품 등이 주도...","12월 23일 월요일 겨울관련주 테마주 종가를 알아본다. 이 날 겨울관련주주를 견인한 것은 신일산업 종목이다. 신일산업은 주당 1,825원의 거래가격으로 전일대비+2.24%의 등락률을 기록 겨울관련주테마주를..."
525,"[09시 19분 우주항공산업 오전의 테마종목] 현대로템,대한항공 등이 주도...","테마주, 관련 현황을 알아본다. 09시 19분 현재 우주항공산업주를 견인하고 있는 것은 현대로템 종목이다. 현대로템은 주당 15,900원의 거래가격으로 전일대비+2.25%의 등락률을 기록 우주항공산업테마주를..."
526,"[09시 16분 원자력발전소 해체 오전의 테마종목] 휴림로봇,한전기술 등이 상승...","테마주, 관련 현황을 알아본다. 09시 16분 현재 원자력발전소 해체주를 견인하고 있는 것은 휴림로봇 종목이다. 휴림로봇은 주당 1,125원의 거래가격으로 전일대비+2.27%의 등락률을 기록 원자력발전소 해체테마주를..."
527,"[24일 09시 그래핀 오전의 테마종목] 상보,오리엔트정공 등이 상승세 견인중","그래핀 테마주, 관련 현황을 알아본다. 09시 18분 현재 그래핀주를 견인하고 있는 것은 상보 종목이다. 상보는 주당 1,055원의 거래가격으로 전일대비+1.44%의 등락률을 기록 그래핀테마주를 주도하고 있는 것으로..."
528,"[24일 09시 출산장려정책 오전의 테마종목] 캐리소프트,깨끗한나라 등이 주도","테마주, 관련 현황을 알아본다. 09시 13분 현재 출산장려정책주를 견인하고 있는 것은 캐리소프트 종목이다. 캐리소프트는 주당 8,260원의 거래가격으로 전일대비+7.55%의 등락률을 기록 출산장려정책테마주를..."
529,"[17일 13시 슈퍼박테리아 테마주 시황-오후] 큐로컴,인트론바이오 등이 상승세...","슈퍼박테리아 테마주, 관련 현황을 알아본다. 13시 23분 현재 슈퍼박테리아주를 견인하고 있는 것은 큐로컴 종목이다. 큐로컴은 주당 1,930원의 거래가격으로 전일대비+7.52%의 등락률을 기록 슈퍼박테리아테마주를..."
530,"[17일 13시 슈퍼박테리아 테마주 시황-오후] 큐로컴,인트론바이오 등이 상승세...","슈퍼박테리아 테마주, 관련 현황을 알아본다. 13시 23분 현재 슈퍼박테리아주를 견인하고 있는 것은 큐로컴 종목이다. 큐로컴은 주당 1,930원의 거래가격으로 전일대비+7.52%의 등락률을 기록 슈퍼박테리아테마주를..."
531,"[3D 낸드(NAND) 테마주-마감] 피에스케이홀딩스,피에스케이 등이 주도","(NAND) 테마주 종가를 알아본다. 이 날 3D 낸드(NAND)주를 견인한 것은 피에스케이홀딩스 종목이다. 피에스케이홀딩스는 주당 8,900원의 거래가격으로 전일대비+12.94%의 등락률을 기록 3D 낸드(NAND)테마주를..."
532,"[13시 25분 음식료업종 오후 테마시황] 한국맥널티,삼양식품 등이 주도","테마주, 관련 현황을 알아본다. 13시 25분 현재 음식료업종주를 견인하고 있는 것은 한국맥널티 종목이다. 한국맥널티는 주당 7,060원의 거래가격으로 전일대비+23.21%의 등락률을 기록 음식료업종테마주를 주도하고..."
533,"[13시 23분 은행 오후 테마시황] 우리금융지주,KB금융 등이 주도...","은행 테마주, 관련 현황을 알아본다. 13시 23분 현재 은행주를 견인하고 있는 것은 우리금융지주 종목이다. 우리금융지주는 주당 12,200원의 거래가격으로 전일대비+1.67%의 등락률을 기록 은행테마주를 주도하고..."
534,"[23일 09시 면역항암제 오전 테마시황] 필룩스,에이비엘바이오 등이 주도","면역항암제 테마주, 관련 현황을 알아본다. 09시 12분 현재 면역항암제주를 견인하고 있는 것은 필룩스 종목이다. 필룩스는 주당 7,830원의 거래가격으로 전일대비+5.24%의 등락률을 기록 면역항암제테마주를..."
535,"[화학섬유 테마 마감시황] 코오롱머티리얼,태광산업 등이 상승세 견인중","12월 23일 월요일 화학섬유 테마주 종가를 알아본다. 이 날 화학섬유주를 견인한 것은 코오롱머티리얼 종목이다. 코오롱머티리얼은 주당 1,545원의 거래가격으로 전일대비+2.66%의 등락률을 기록 화학섬유테마주를..."
536,"[17일 09시 증강현실(AR) 테마주 시황-오전] 필링크,이랜텍 등이 상승세 주도","(AR) 테마주, 관련 현황을 알아본다. 09시 12분 현재 증강현실(AR)주를 견인하고 있는 것은 필링크 종목이다. 필링크는 주당 1,545원의 거래가격으로 전일대비+4.75%의 등락률을 기록 증강현실(AR)테마주를 주도하고..."
537,"[13시 25분 반도체 재료/부품 테마주 시황-오후] 마이크로컨텍솔,하나마이크론...","12월 18일 수요일 이시간 현재 반도체 재료/부품 테마주, 관련 현황을 알아본다. 13시 25분 현재 반도체... 마이크로컨텍솔은 주당 4,115원의 거래가격으로 전일대비+8.72%의 등락률을 기록 반도체 재료/부품테마주를..."
538,"[GTX(수도권 광역급행철도) 테마주 시황-마감] 대아티아이,현대로템 등이 주도","테마주 종가를 알아본다. 이 날 GTX(수도권 광역급행철도)주를 견인한 것은 대아티아이 종목이다. 대아티아이는 주당 5,380원의 거래가격으로 전일대비+5.49%의 등락률을 기록 GTX(수도권 광역급행철도)테마주를..."
539,"[재난/안전(지진 등) 테마주 시황-마감] 한창,유엔젤 등이 주도...","등) 테마주 종가를 알아본다. 이 날 재난/안전(지진 등)주를 견인한 것은 한창 종목이다. 한창은 주당 2,820원의 거래가격으로 전일대비+4.25%의 등락률을 기록 재난/안전(지진 등)테마주를 주도한 것으로 알려졌다...."
540,"[09시 17분 2차전지 테마주 시황-오전] 에이에프더블류,솔브레인 등이 주도","2차전지 테마주, 관련 현황을 알아본다. 09시 17분 현재 2차전지주를 견인하고 있는 것은 에이에프더블류 종목이다. 에이에프더블류는 주당 12,550원의 거래가격으로 전일대비+6.36%의 등락률을 기록 2차전지테마주..."
541,"[09시 13분 IT 대표주 테마주 오전 시황] SK하이닉스,삼성전자 등이 상승세 주...","대표주 테마주, 관련 현황을 알아본다. 09시 13분 현재 IT 대표주주를 견인하고 있는 것은 SK하이닉스 종목이다. SK하이닉스는 주당 96,000원의 거래가격으로 전일대비+3.23%의 등락률을 기록 IT 대표주테마주를..."
542,"[19일 09시 LED장비 테마주 시황-오전] 한미반도체,주성엔지니어링 등이 주도","LED장비 테마주, 관련 현황을 알아본다. 09시 15분 현재 LED장비주를 견인하고 있는 것은 한미반도체 종목이다. 한미반도체는 주당 8,070원의 거래가격으로 전일대비+2.02%의 등락률을 기록 LED장비테마주를..."
543,"[16일 11시 5G(5세대 이동통신) 테마주 시황-오전] 에이스테크,매직마이크로 ...","12월 16일 월요일 이시간 현재 5G(5세대 이동통신) 테마주, 관련 현황을 알아본다. 11시 04분 현재 5G(5세대... 에이스테크는 주당 7,690원의 거래가격으로 전일대비+6.36%의 등락률을 기록 5G(5세대 이동통신)테마주를..."
544,"[11시 04분 블록체인 테마주 시황-오전] 팍스넷,포티스 등이 주도","블록체인 테마주, 관련 현황을 알아본다. 11시 04분 현재 블록체인주를 견인하고 있는 것은 팍스넷 종목이다. 팍스넷은 주당 4,040원의 거래가격으로 전일대비+29.90%의 등락률을 기록 블록체인테마주를 주도하고..."
545,"[19일 13시 황사/미세먼지 테마주 오후 시황] 삼일제약,크린앤사이언스 등이 ...","테마주, 관련 현황을 알아본다. 13시 23분 현재 황사/미세먼지주를 견인하고 있는 것은 삼일제약 종목이다. 삼일제약은 주당 24,950원의 거래가격으로 전일대비+26.01%의 등락률을 기록 황사/미세먼지테마주를..."
546,"[시스템반도체 테마주 시황-마감] DB하이텍,피에스케이 등이 상승세 주도","12월 17일 화요일 시스템반도체 테마주 종가를 알아본다. 이 날 시스템반도체주를 견인한 것은 DB하이텍 종목이다. DB하이텍은 주당 25,800원의 거래가격으로 전일대비+10.73%의 등락률을 기록 시스템반도체테마주..."
