,title,contents
1501,"[27일 09시 PCB생산 테마주 오전 시황] 이수페타시스,이녹스 등이 상승세 견인...","PCB생산 테마주, 관련 현황을 알아본다. 09시 35분 현재 PCB생산주를 견인하고 있는 것은 이수페타시스 종목이다. 이수페타시스는 주당 3,870원의 거래가격으로 전일대비+1.44%의 등락률을 기록 PCB생산테마주를..."
1502,"[27일 09시 사료 테마주 시황-오전] 케이씨피드,팜스토리 등이 주도","사료 테마주, 관련 현황을 알아본다. 09시 32분 현재 사료주를 견인하고 있는 것은 케이씨피드 종목이다. 케이씨피드는 주당 2,555원의 거래가격으로 전일대비+4.71%의 등락률을 기록 사료테마주를 주도하고 있는..."
1503,"[13시 24분 물류 테마주 오후 시황] 현대글로비스,CJ대한통운 등이 상승세 주...","물류 테마주, 관련 현황을 알아본다. 13시 24분 현재 물류주를 견인하고 있는 것은 현대글로비스 종목이다. 현대글로비스는 주당 154,000원의 거래가격으로 전일대비+2.33%의 등락률을 기록 물류테마주를 주도하고..."
1504,"[13시 28분 수산주 오후의 테마종목] CJ씨푸드,사조산업 등이 상승세 견인중","수산주 테마주, 관련 현황을 알아본다. 13시 28분 현재 수산주주를 견인하고 있는 것은 CJ씨푸드 종목이다. CJ씨푸드는 주당 2,670원의 거래가격으로 전일대비+1.14%의 등락률을 기록 수산주테마주를 주도하고 있는..."
1505,"[6일 10시 태양광 오전 테마시황] 주성엔지니어링,티씨케이 등이 주도","태양광 테마주, 관련 현황을 알아본다. 10시 37분 현재 태양광주를 견인하고 있는 것은 주성엔지니어링 종목이다. 주성엔지니어링은 주당 6,540원의 거래가격으로 전일대비+2.99%의 등락률을 기록 태양광테마주를..."
1506,"[13시 25분 IT대표주 오후 테마시황] SK하이닉스,삼성전자 등이 주도","IT대표주 테마주, 관련 현황을 알아본다. 13시 25분 현재 IT대표주주를 견인하고 있는 것은 SK하이닉스 종목이다. SK하이닉스는 주당 80,700원의 거래가격으로 전일대비+2.41%의 등락률을 기록 IT대표주테마주를..."
1507,"[9일 10시 지주회사 오전의 테마종목] 일진홀딩스,STX 등이 상승세 주도","지주회사 테마주, 관련 현황을 알아본다. 10시 34분 현재 지주회사주를 견인하고 있는 것은 일진홀딩스 종목이다. 일진홀딩스는 주당 5,550원의 거래가격으로 전일대비+9.25%의 등락률을 기록 지주회사테마주를..."
1508,"[6일 10시 금 관련주 오전 테마시황] TIGER 금은선물(H),정산애강 등이 주도....","테마주, 관련 현황을 알아본다. 10시 40분 현재 금 관련주주를 견인하고 있는 것은 TIGER 금은선물(H) 종목이다. TIGER 금은선물(H)은 주당 8,190원의 거래가격으로 전일대비+0.06%의 등락률을 기록 금 관련주테마주..."
1509,"[탄소 배출권 테마 마감시황] 에코프로,한솔홈데코 등이 상승세 주도","12월 6일 금요일 탄소 배출권 테마주 종가를 알아본다. 이 날 탄소 배출권주를 견인한 것은 에코프로 종목이다. 에코프로는 주당 19,300원의 거래가격으로 전일대비+3.21%의 등락률을 기록 탄소 배출권테마주를..."
1510,"[6일 10시 금 관련주 오전 테마시황] TIGER 금은선물(H),정산애강 등이 주도....","테마주, 관련 현황을 알아본다. 10시 40분 현재 금 관련주주를 견인하고 있는 것은 TIGER 금은선물(H) 종목이다. TIGER 금은선물(H)은 주당 8,190원의 거래가격으로 전일대비+0.06%의 등락률을 기록 금 관련주테마주..."
1511,"[탄소 배출권 테마 마감시황] 에코프로,한솔홈데코 등이 상승세 주도","12월 6일 금요일 탄소 배출권 테마주 종가를 알아본다. 이 날 탄소 배출권주를 견인한 것은 에코프로 종목이다. 에코프로는 주당 19,300원의 거래가격으로 전일대비+3.21%의 등락률을 기록 탄소 배출권테마주를..."
1512,"[바이오시밀러 테마 마감시황] 에이프로젠제약,제넥신 등이 상승세 주도","바이오시밀러 테마주 종가를 알아본다. 이 날 바이오시밀러주를 견인한 것은 에이프로젠제약 종목이다. 에이프로젠제약은 주당 1,070원의 거래가격으로 전일대비+4.39%의 등락률을 기록 바이오시밀러테마주를..."
1513,"[11일 13시 태양광 오후의 테마종목] SDN,주성엔지니어링 등이 상승세 주도","12월 11일 수요일 이시간 현재 태양광 테마주, 관련 현황을 알아본다. 13시 26분 현재 태양광주를 견인하고 있는 것은 SDN 종목이다. SDN은 주당 2,870원의 거래가격으로 전일대비+0.88%의 등락률을 기록 태양광테마주..."
1514,"[11일 10시 국내상장 중국기업 오전 테마시황] GRT,골든센츄리 등이 상승세 견...","중국기업 테마주, 관련 현황을 알아본다. 10시 34분 현재 국내상장 중국기업주를 견인하고 있는 것은 GRT 종목이다. GRT은 주당 2,360원의 거래가격으로 전일대비+2.16%의 등락률을 기록 국내상장 중국기업테마주를..."
1515,"[11일 10시 자동차 대표주 오전 테마시황] 쌍용차,한라홀딩스 등이 상승세 견...","대표주 테마주, 관련 현황을 알아본다. 10시 35분 현재 자동차 대표주주를 견인하고 있는 것은 쌍용차 종목이다. 쌍용차는 주당 1,830원의 거래가격으로 전일대비+1.10%의 등락률을 기록 자동차 대표주테마주를..."
1516,"[방위산업 테마 마감시황] 빅텍,휴니드 등이 주도...","12월 6일 금요일 방위산업 테마주 종가를 알아본다. 이 날 방위산업주를 견인한 것은 빅텍 종목이다. 빅텍은 주당 3,210원의 거래가격으로 전일대비+3.05%의 등락률을 기록 방위산업테마주를 주도한 것으로..."
1517,"[뉴욕증시] 다우지수 흔들, 미중 무역협상 끝내 결렬 중국 희토류 수출금지 …...",미중 무역협상이 사실상 결렬됐다는 소식이 나오면서 중국 중국의 희토류 테마주 주가가 큰 폭으로 오르고 있다. 중국 희토류 테마주 주가 급등은 미국 뉴욕증시 다우지수와 코스피 코스닥 그리고 원달러환율에...
1518,"[농업주 테마종목 종가] 조비,경농 등이 상승세 주도","12월 6일 금요일 농업주 테마주 종가를 알아본다. 이 날 농업주주를 견인한 것은 조비 종목이다. 조비는 주당 15,100원의 거래가격으로 전일대비+2.37%의 등락률을 기록 농업주테마주를 주도한 것으로 알려졌다...."
1519,"[IT대표주 테마 마감시황] LG디스플레이,삼성전자 등이 상승세 주도","12월 9일 월요일 IT대표주 테마주 종가를 알아본다. 이 날 IT대표주주를 견인한 것은 LG디스플레이 종목이다. LG디스플레이는 주당 16,100원의 거래가격으로 전일대비+9.52%의 등락률을 기록 IT대표주테마주를..."
1520,"[13시 22분 여행/관광 오후의 테마종목] 아시아나항공,호텔신라 등이 상승세 ...","관광 테마주, 관련 현황을 알아본다. 13시 22분 현재 여행/관광주를 견인하고 있는 것은 아시아나항공 종목이다. 아시아나항공은 주당 5,480원의 거래가격으로 전일대비+3.40%의 등락률을 기록 여행/관광테마주를..."
1521,"[10시 36분 소프트웨어 개발 및 게임 오전 테마시황] 플레이위드,엔텔스 등이...","12월 10일 화요일 이시간 현재 소프트웨어 개발 및 게임 테마주, 관련 현황을 알아본다. 10시 36분 현재... 플레이위드는 주당 17,750원의 거래가격으로 전일대비+2.90%의 등락률을 기록 소프트웨어 개발 및 게임테마주를..."
1522,"[13시 26분 LED산업 오후의 테마종목] 루미마이크로,삼성전기 등이 상승세 주...","LED산업 테마주, 관련 현황을 알아본다. 13시 26분 현재 LED산업주를 견인하고 있는 것은 루미마이크로 종목이다. 루미마이크로는 주당 2,455원의 거래가격으로 전일대비+2.29%의 등락률을 기록 LED산업테마주를..."
1523,"[27일 13시 플렉서블 디스플레이 테마주 시황-오후] 덕산하이메탈,에스에프에...","11월 27일 수요일 이시간 현재 플렉서블 디스플레이 테마주, 관련 현황을 알아본다. 13시 28분 현재... 덕산하이메탈은 주당 7,650원의 거래가격으로 전일대비+2.00%의 등락률을 기록 플렉서블 디스플레이테마주를..."
1524,"[27일 13시 방위산업 테마주 오후 시황] 휴니드,퍼스텍 등이 상승세 주도","방위산업 테마주, 관련 현황을 알아본다. 13시 25분 현재 방위산업주를 견인하고 있는 것은 휴니드 종목이다. 휴니드는 주당 7,220원의 거래가격으로 전일대비+1.40%의 등락률을 기록 방위산업테마주를 주도하고..."
1525,"[13시 22분 백화점 오후의 테마종목] 한화갤러리아타임월드,롯데쇼핑 등이 주...","11월 27일 수요일 이시간 현재 백화점 테마주, 관련 현황을 알아본다. 13시 22분 현재 백화점주를 견인하고... 한화갤러리아타임월드는 주당 25,800원의 거래가격으로 전일대비+16.48%의 등락률을 기록 백화점테마주를..."
1526,"[09시 35분 스마트폰 부품주 테마주 오전 시황] 솔브레인,유아이디 등이 상승...","테마주, 관련 현황을 알아본다. 09시 35분 현재 스마트폰 부품주주를 견인하고 있는 것은 솔브레인 종목이다. 솔브레인은 주당 72,300원의 거래가격으로 전일대비+1.83%의 등락률을 기록 스마트폰 부품주테마주를..."
1527,"[10시 37분 교육 오전의 테마종목] YBM넷,코너스톤네트웍스 등이 주도...","12월 12일 목요일 이시간 현재 교육 테마주, 관련 현황을 알아본다. 10시 37분 현재 교육주를 견인하고 있는 것은 YBM넷 종목이다. YBM넷은 주당 3,865원의 거래가격으로 전일대비+3.07%의 등락률을 기록 교육테마주를..."
1528,"[6일 10시 사료 오전의 테마종목] 고려산업,한일사료 등이 상승세 견인중","사료 테마주, 관련 현황을 알아본다. 10시 35분 현재 사료주를 견인하고 있는 것은 고려산업 종목이다. 고려산업은 주당 3,430원의 거래가격으로 전일대비+2.24%의 등락률을 기록 사료테마주를 주도하고 있는 것으로..."
1529,"[6일 13시 탄소 배출권 오후의 테마종목] 후성,에코프로 등이 상승세 주도","배출권 테마주, 관련 현황을 알아본다. 13시 23분 현재 탄소 배출권주를 견인하고 있는 것은 후성 종목이다. 후성은 주당 7,530원의 거래가격으로 전일대비+3.15%의 등락률을 기록 탄소 배출권테마주를 주도하고 있는..."
1530,"[13시 24분 PCB생산 오후 테마시황] 인터플렉스,비에이치 등이 상승세 주도","PCB생산 테마주, 관련 현황을 알아본다. 13시 24분 현재 PCB생산주를 견인하고 있는 것은 인터플렉스 종목이다. 인터플렉스는 주당 16,000원의 거래가격으로 전일대비+4.92%의 등락률을 기록 PCB생산테마주를..."
1531,"[6일 13시 풍력에너지 오후 테마시황] 태웅,한일단조 등이 주도","풍력에너지 테마주, 관련 현황을 알아본다. 13시 28분 현재 풍력에너지주를 견인하고 있는 것은 태웅 종목이다. 태웅은 주당 8,720원의 거래가격으로 전일대비+2.59%의 등락률을 기록 풍력에너지테마주를 주도하고..."
1532,"[6일 10시 LBS관련주 오전 테마시황] 파트론,팅크웨어 등이 주도","LBS관련주 테마주, 관련 현황을 알아본다. 10시 33분 현재 LBS관련주주를 견인하고 있는 것은 파트론 종목이다. 파트론은 주당 12,700원의 거래가격으로 전일대비+5.83%의 등락률을 기록 LBS관련주테마주를 주도하고..."
1533,"[9일 13시 수산주 오후의 테마종목] 동원수산,신라교역 등이 상승세 주도","수산주 테마주, 관련 현황을 알아본다. 13시 24분 현재 수산주주를 견인하고 있는 것은 동원수산 종목이다. 동원수산은 주당 10,300원의 거래가격으로 전일대비+1.48%의 등락률을 기록 수산주테마주를 주도하고 있는..."
1534,"[10시 36분 LED산업 오전 테마시황] 일진디스플,빛샘전자 등이 상승세 주도","LED산업 테마주, 관련 현황을 알아본다. 10시 36분 현재 LED산업주를 견인하고 있는 것은 일진디스플 종목이다. 일진디스플은 주당 3,465원의 거래가격으로 전일대비+5.32%의 등락률을 기록 LED산업테마주를..."
1535,"[9일 13시 소프트웨어 개발 및 게임 오후 테마시황] 위메이드,엔텔스 등이 주...","12월 9일 월요일 이시간 현재 소프트웨어 개발 및 게임 테마주, 관련 현황을 알아본다. 13시 25분 현재... 위메이드는 주당 30,350원의 거래가격으로 전일대비+6.12%의 등락률을 기록 소프트웨어 개발 및 게임테마주를..."
1536,"[9일 10시 보험 오전의 테마종목] 한화생명,흥국화재 등이 상승세 견인중","보험 테마주, 관련 현황을 알아본다. 10시 35분 현재 보험주를 견인하고 있는 것은 한화생명 종목이다. 한화생명은 주당 2,255원의 거래가격으로 전일대비+1.58%의 등락률을 기록 보험테마주를 주도하고 있는..."
1537,"[9일 13시 스마트폰 부품주 오후 테마시황] LG디스플레이,유아이디 등이 주도","12월 9일 월요일 이시간 현재 스마트폰 부품주 테마주, 관련 현황을 알아본다. 13시 23분 현재 스마트폰... LG디스플레이는 주당 15,950원의 거래가격으로 전일대비+8.50%의 등락률을 기록 스마트폰 부품주테마주를..."
1538,"[10시 37분 전선 오전의 테마종목] 가온전선,대한전선 등이 주도","전선 테마주, 관련 현황을 알아본다. 10시 37분 현재 전선주를 견인하고 있는 것은 가온전선 종목이다. 가온전선은 주당 22,750원의 거래가격으로 전일대비+1.79%의 등락률을 기록 전선테마주를 주도하고 있는..."
1539,"[10시 33분 소프트웨어 개발 및 게임 오전 테마시황] 위메이드,조이시티 등이...","12월 11일 수요일 이시간 현재 소프트웨어 개발 및 게임 테마주, 관련 현황을 알아본다. 10시 33분 현재... 위메이드는 주당 32,300원의 거래가격으로 전일대비+7.67%의 등락률을 기록 소프트웨어 개발 및 게임테마주를..."
1540,"[10시 37분 전선 오전의 테마종목] 가온전선,대한전선 등이 주도","전선 테마주, 관련 현황을 알아본다. 10시 37분 현재 전선주를 견인하고 있는 것은 가온전선 종목이다. 가온전선은 주당 22,750원의 거래가격으로 전일대비+1.79%의 등락률을 기록 전선테마주를 주도하고 있는..."
1541,"[10시 33분 소프트웨어 개발 및 게임 오전 테마시황] 위메이드,조이시티 등이...","12월 11일 수요일 이시간 현재 소프트웨어 개발 및 게임 테마주, 관련 현황을 알아본다. 10시 33분 현재... 위메이드는 주당 32,300원의 거래가격으로 전일대비+7.67%의 등락률을 기록 소프트웨어 개발 및 게임테마주를..."
1542,"[지주회사 테마 마감시황] 일진홀딩스,LG 등이 주도...","12월 6일 금요일 지주회사 테마주 종가를 알아본다. 이 날 지주회사주를 견인한 것은 일진홀딩스 종목이다. 일진홀딩스는 주당 5,080원의 거래가격으로 전일대비+29.76%의 등락률을 기록 지주회사테마주를..."
1543,"[NFC 테마 마감시황] 파트론,유비벨록스 등이 상승세 주도","12월 6일 금요일 NFC 테마주 종가를 알아본다. 이 날 NFC주를 견인한 것은 파트론 종목이다. 파트론은 주당 13,100원의 거래가격으로 전일대비+9.17%의 등락률을 기록 NFC테마주를 주도한 것으로 알려졌다...."
1544,[표][(20일/코스피 주가 Top 50 상승률] 태양금속 주가 상승률 1위 11.48% 올...,"▲ (6위)삼성 건축자재 테마주 ETN, 주가상승률 : 약 6.55% (거래량=  4020주), 20일 삼성 건축자재 테마주 ETN  165원 상승, 시가총액 54억원, 회전율 : 약 0.2% (=하루거래량/상장총주식수=  4020주/2000000주)..."
1545,"[패션 테마 마감시황] 대현,한섬 등이 주도","12월 5일 목요일 패션 테마주 종가를 알아본다. 이 날 패션주를 견인한 것은 대현 종목이다. 대현은 주당 2,410원의 거래가격으로 전일대비+3.21%의 등락률을 기록 패션테마주를 주도한 것으로 알려졌다...."
1546,"[9일 13시 IT대표주 오후 테마시황] LG디스플레이,삼성전자 등이 상승세 주도","테마주, 관련 현황을 알아본다. 13시 22분 현재 IT대표주주를 견인하고 있는 것은 LG디스플레이 종목이다. LG디스플레이는 주당 15,950원의 거래가격으로 전일대비+8.50%의 등락률을 기록 IT대표주테마주를..."
1547,"주연테크‧서원, 이낙연 관련주 지지부진…특히 서원 가파른 하락세로 4%대 낙...",현재 주연테크는 투자자 사이에서 '이낙연 테마주'로 불리우고 있다. 노무현 정부 당시 차관을 지냈던... 서원은 최홍건 사외이사가 이낙연 국무총리와 서울대 법대 동문이여서 테마주로 언급되고 있다.
1548,"[10시 37분 교육 오전 테마시황] 메가스터디,멀티캠퍼스 등이 주도...","교육 테마주, 관련 현황을 알아본다. 10시 37분 현재 교육주를 견인하고 있는 것은 메가스터디 종목이다. 메가스터디는 주당 12,200원의 거래가격으로 전일대비+1.24%의 등락률을 기록 교육테마주를 주도하고 있는..."
1549,"[10일 13시 농업주 오후의 테마종목] KG케미칼,이지바이오 등이 상승세 주도","농업주 테마주, 관련 현황을 알아본다. 13시 26분 현재 농업주주를 견인하고 있는 것은 KG케미칼 종목이다. KG케미칼은 주당 11,000원의 거래가격으로 전일대비+0.46%의 등락률을 기록 농업주테마주를 주도하고 있는..."
1550,"[10일 13시 스마트폰 부품주 오후의 테마종목] 켐트로닉스,파워로직스 등이 주...","12월 10일 화요일 이시간 현재 스마트폰 부품주 테마주, 관련 현황을 알아본다. 13시 26분 현재 스마트폰... 켐트로닉스는 주당 15,350원의 거래가격으로 전일대비+1.32%의 등락률을 기록 스마트폰 부품주테마주를..."
1551,"[10일 13시 소프트웨어 개발 및 게임 오후 테마시황] 플레이위드,조이시티 등...","12월 10일 화요일 이시간 현재 소프트웨어 개발 및 게임 테마주, 관련 현황을 알아본다. 13시 25분 현재... 플레이위드는 주당 18,200원의 거래가격으로 전일대비+5.51%의 등락률을 기록 소프트웨어 개발 및 게임테마주를..."
1552,"[10일 13시 여행/관광 오후 테마시황] 대한항공,아시아나항공 등이 상승세 견...","여행/관광 테마주, 관련 현황을 알아본다. 13시 23분 현재 여행/관광주를 견인하고 있는 것은 대한항공 종목이다. 대한항공은 주당 26,750원의 거래가격으로 전일대비+2.29%의 등락률을 기록 여행/관광테마주를..."
1553,"[10일 10시 사료 오전 테마시황] 케이씨피드,고려산업 등이 상승세 견인중","사료 테마주, 관련 현황을 알아본다. 10시 36분 현재 사료주를 견인하고 있는 것은 케이씨피드 종목이다. 케이씨피드는 주당 2,330원의 거래가격으로 전일대비+0.65%의 등락률을 기록 사료테마주를 주도하고 있는..."
1554,"[09시 34분 엔터테인먼트 테마주 시황-오전] 팬엔터테인먼트,큐브엔터 등이 상...","11월 27일 수요일 이시간 현재 엔터테인먼트 테마주, 관련 현황을 알아본다. 09시 34분 현재... 팬엔터테인먼트는 주당 4,900원의 거래가격으로 전일대비+3.70%의 등락률을 기록 엔터테인먼트테마주를 주도하고 있는..."
1555,"[13시 26분 태양광 오후 테마시황] 에스엔유,주성엔지니어링 등이 상승세 견인...","태양광 테마주, 관련 현황을 알아본다. 13시 26분 현재 태양광주를 견인하고 있는 것은 에스엔유 종목이다. 에스엔유는 주당 2,500원의 거래가격으로 전일대비+3.95%의 등락률을 기록 태양광테마주를 주도하고 있는..."
1556,"[6일 10시 물류 오전의 테마종목] 한진,한익스프레스 등이 상승세 주도","12월 6일 금요일 이시간 현재 물류 테마주, 관련 현황을 알아본다. 10시 33분 현재 물류주를 견인하고 있는 것은 한진 종목이다. 한진은 주당 30,700원의 거래가격으로 전일대비+7.53%의 등락률을 기록 물류테마주를..."
1557,"[13시 26분 PCB생산 오후 테마시황] 이수페타시스,슈펙스비앤피 등이 상승세 ...","PCB생산 테마주, 관련 현황을 알아본다. 13시 26분 현재 PCB생산주를 견인하고 있는 것은 이수페타시스 종목이다. 이수페타시스는 주당 3,775원의 거래가격으로 전일대비+1.62%의 등락률을 기록 PCB생산테마주를..."
1558,"[13시 26분 백화점 오후 테마시황] 현대백화점,대구백화점 등이 상승세 견인중","백화점 테마주, 관련 현황을 알아본다. 13시 26분 현재 백화점주를 견인하고 있는 것은 현대백화점 종목이다. 현대백화점은 주당 83,700원의 거래가격으로 전일대비+2.07%의 등락률을 기록 백화점테마주를 주도하고..."
1559,"[9일 13시 헬스케어 오후의 테마종목] 메타바이오메드,세운메디칼 등이 주도....","테마주, 관련 현황을 알아본다. 13시 28분 현재 헬스케어주를 견인하고 있는 것은 메타바이오메드 종목이다. 메타바이오메드는 주당 2,520원의 거래가격으로 전일대비+1.20%의 등락률을 기록 헬스케어테마주를..."
1560,"[9일 13시 헬스케어 오후의 테마종목] 메타바이오메드,세운메디칼 등이 주도....","테마주, 관련 현황을 알아본다. 13시 28분 현재 헬스케어주를 견인하고 있는 것은 메타바이오메드 종목이다. 메타바이오메드는 주당 2,520원의 거래가격으로 전일대비+1.20%의 등락률을 기록 헬스케어테마주를..."
1561,"[탄소 배출권 테마 마감시황] 휴켐스,유니슨 등이 주도...","12월 5일 목요일 탄소 배출권 테마주 종가를 알아본다. 이 날 탄소 배출권주를 견인한 것은 휴켐스 종목이다. 휴켐스는 주당 21,650원의 거래가격으로 전일대비+1.64%의 등락률을 기록 탄소 배출권테마주를 주도한..."
1562,"[전선 테마종목 종가] 대원전선,가온전선 등이 상승세 견인중","12월 5일 목요일 전선 테마주 종가를 알아본다. 이 날 전선주를 견인한 것은 대원전선 종목이다. 대원전선은 주당 1,220원의 거래가격으로 전일대비+3.83%의 등락률을 기록 전선테마주를 주도한 것으로 알려졌다...."
1563,"[교육 테마종목 종가] NE능률,코너스톤네트웍스 등이 주도","12월 5일 목요일 교육 테마주 종가를 알아본다. 이 날 교육주를 견인한 것은 NE능률 종목이다. NE능률은 주당 3,725원의 거래가격으로 전일대비+4.05%의 등락률을 기록 교육테마주를 주도한 것으로 알려졌다...."
1564,"[9일 10시 주류 오전 테마시황] MH에탄올,보해양조 등이 상승세 견인중","주류 테마주, 관련 현황을 알아본다. 10시 38분 현재 주류주를 견인하고 있는 것은 MH에탄올 종목이다. MH에탄올은 주당 6,190원의 거래가격으로 전일대비+0.81%의 등락률을 기록 주류테마주를 주도하고 있는 것으로..."
1565,"[6일 10시 엔터테인먼트 오전 테마시황] IHQ,키이스트 등이 주도","엔터테인먼트 테마주, 관련 현황을 알아본다. 10시 39분 현재 엔터테인먼트주를 견인하고 있는 것은 IHQ 종목이다. IHQ은 주당 1,635원의 거래가격으로 전일대비+2.51%의 등락률을 기록 엔터테인먼트테마주를..."
1566,"[13시 24분 소프트웨어 개발 및 게임 테마주 오후 시황] 지어소프트,NHN 등이...","11월 27일 수요일 이시간 현재 소프트웨어 개발 및 게임 테마주, 관련 현황을 알아본다. 13시 24분 현재... 97%의 등락률을 기록 소프트웨어 개발 및 게임테마주를 주도하고 있는 것으로 알려졌다. 코스닥상장기업인..."
1567,"써니전자·안랩, 안철수 관련주 모두 상승세…특히 써니전자 가파른 상승세로...",안랩은 안철수 전 대표가 창업한 회사로 안철수 테마주로 분류되고 있다. 안철수 전 대표는 안랩의 지분 18.6%를 보유한 대주주다. 써니전자는 임원이 안랩 출신이라는 이유로 안철수 테마주로 불려왔다....
1568,"[10일 10시 엔터테인먼트 오전 테마시황] NHN벅스,와이지엔터테인먼트 등이 상...","엔터테인먼트 테마주, 관련 현황을 알아본다. 10시 40분 현재 엔터테인먼트주를 견인하고 있는 것은 NHN벅스 종목이다. NHN벅스는 주당 5,290원의 거래가격으로 전일대비+1.93%의 등락률을 기록 엔터테인먼트테마주..."
