,title,contents
956,"[18일 09시 항공/저가 항공사(LCC) 오전의 테마종목] 제주항공,한진칼 등이 상...","12월 18일 수요일 이시간 현재 항공/저가 항공사(LCC) 테마주, 관련 현황을 알아본다. 09시 12분 현재 항공... 제주항공은 주당 26,500원의 거래가격으로 전일대비+2.91%의 등락률을 기록 항공/저가 항공사(LCC)테마주를..."
957,"[09시 11분 블록체인 오전의 테마종목] 주연테크,포티스 등이 주도...","블록체인 테마주, 관련 현황을 알아본다. 09시 11분 현재 블록체인주를 견인하고 있는 것은 주연테크 종목이다. 주연테크는 주당 627원의 거래가격으로 전일대비+25.40%의 등락률을 기록 블록체인테마주를 주도하고..."
958,"[13시 23분 은행 오후 테마시황] KB금융,하나금융지주 등이 상승세 주도","은행 테마주, 관련 현황을 알아본다. 13시 23분 현재 은행주를 견인하고 있는 것은 KB금융 종목이다. KB금융은 주당 49,200원의 거래가격으로 전일대비+2.61%의 등락률을 기록 은행테마주를 주도하고 있는 것으로..."
959,"[스마트폰 부품주 테마주-마감] 켐트로닉스,파워로직스 등이 주도...","부품주 테마주 종가를 알아본다. 이 날 스마트폰 부품주주를 견인한 것은 켐트로닉스 종목이다. 켐트로닉스는 주당 15,500원의 거래가격으로 전일대비+2.31%의 등락률을 기록 스마트폰 부품주테마주를 주도한..."
960,‘문재인 테마주’ 서희건설 이봉관 회장 탐구① 주가 농단 의혹,"‘문재인 테마주’로 불리던 기업이 문 대통령의 공언을 무색하게 하고 있다. 서희건설 창업주인 이봉관... 2017년 5월, 문 대통령이 취임하자 서희건설은 ‘테마주’로 떠오르며 급성장을 이뤘다. 이봉관 회장은 문..."
961,"[10시 40분 풍력에너지 테마주 오전 시황] 유니슨,씨에스윈드 등이 상승세 주...","풍력에너지 테마주, 관련 현황을 알아본다. 10시 40분 현재 풍력에너지주를 견인하고 있는 것은 유니슨 종목이다. 유니슨은 주당 972원의 거래가격으로 전일대비보합세의 등락률을 기록 풍력에너지테마주를..."
962,"[10시 35분 백화점 테마주 오전 시황] 대구백화점,롯데쇼핑 등이 상승세 주도","백화점 테마주, 관련 현황을 알아본다. 10시 35분 현재 백화점주를 견인하고 있는 것은 대구백화점 종목이다. 대구백화점은 주당 5,990원의 거래가격으로 전일대비+3.10%의 등락률을 기록 백화점테마주를 주도하고..."
963,"[11일 13시 2차전지 관련주 테마주 시황-오후] 피앤이솔루션,이랜텍 등이 상승...","12월 11일 수요일 이시간 현재 2차전지 관련주 테마주, 관련 현황을 알아본다. 13시 22분 현재 2차전지... 피앤이솔루션은 주당 10,050원의 거래가격으로 전일대비+4.25%의 등락률을 기록 2차전지 관련주테마주를..."
964,"[카지노 테마주 시황-마감] 파라다이스,토비스 등이 주도...","12월 9일 월요일 카지노 테마주 종가를 알아본다. 이 날 카지노주를 견인한 것은 파라다이스 종목이다. 파라다이스는 주당 18,800원의 거래가격으로 전일대비+1.08%의 등락률을 기록 카지노테마주를 주도한 것으로..."
965,"[13시 27분 제약업체 오후 테마시황] 녹십자웰빙,비씨월드제약 등이 상승세 주...","제약업체 테마주, 관련 현황을 알아본다. 13시 27분 현재 제약업체주를 견인하고 있는 것은 녹십자웰빙 종목이다. 녹십자웰빙은 주당 10,950원의 거래가격으로 전일대비+14.78%의 등락률을 기록 제약업체테마주를..."
966,"[13시 25분 엔터테인먼트 테마주 오후 시황] SBS콘텐츠허브,소리바다 등이 상...","테마주, 관련 현황을 알아본다. 13시 25분 현재 엔터테인먼트주를 견인하고 있는 것은 SBS콘텐츠허브 종목이다. SBS콘텐츠허브는 주당 5,290원의 거래가격으로 전일대비+3.12%의 등락률을 기록 엔터테인먼트테마주를..."
967,"""주가조작범은 개미를 노린다""...""공매도 기획감시할 것""",테마주가 기승을 부리면서 최근 한국거래소가 모니터링 중인 관련주가 130개에 이르는 것으로 나타났다.... 최근 정치 테마주 등 기업 본질과 무관하게 주가가 급등락하는 사례가 늘고 있는 테마주 열풍에 대해 강한...
968,"[19일 09시 3D 낸드(NAND) 오전의 테마종목] 유니테스트,유진테크 등이 상승세...","테마주, 관련 현황을 알아본다. 09시 11분 현재 3D 낸드(NAND)주를 견인하고 있는 것은 유니테스트 종목이다. 유니테스트는 주당 15,200원의 거래가격으로 전일대비+4.47%의 등락률을 기록 3D 낸드(NAND)테마주를..."
969,"[19일 09시 태양광에너지 오전 테마시황] 유니테스트,테스 등이 주도","테마주, 관련 현황을 알아본다. 09시 17분 현재 태양광에너지주를 견인하고 있는 것은 유니테스트 종목이다. 유니테스트는 주당 15,200원의 거래가격으로 전일대비+4.47%의 등락률을 기록 태양광에너지테마주를..."
970,"[19일 09시 태양광에너지 오전 테마시황] 유니테스트,테스 등이 주도","테마주, 관련 현황을 알아본다. 09시 17분 현재 태양광에너지주를 견인하고 있는 것은 유니테스트 종목이다. 유니테스트는 주당 15,200원의 거래가격으로 전일대비+4.47%의 등락률을 기록 태양광에너지테마주를..."
971,"[13시 28분 바이오시밀러(복제 바이오의약품) 오후 테마시황] 셀트리온제약,알...","12월 20일 금요일 이시간 현재 바이오시밀러(복제 바이오의약품) 테마주, 관련 현황을 알아본다. 13시 28분... 03%의 등락률을 기록 바이오시밀러(복제 바이오의약품)테마주를 주도하고 있는 것으로 알려졌다...."
972,"[10일 10시 농업주 테마주 오전 시황] 효성오앤비,남해화학 등이 주도...","농업주 테마주, 관련 현황을 알아본다. 10시 39분 현재 농업주주를 견인하고 있는 것은 효성오앤비 종목이다. 효성오앤비는 주당 6,520원의 거래가격으로 전일대비+0.15%의 등락률을 기록 농업주테마주를 주도하고..."
973,"[소프트웨어 개발 및 게임 테마주 시황-마감] 플레이위드,조이시티 등이 주도","게임 테마주 종가를 알아본다. 이 날 소프트웨어 개발 및 게임주를 견인한 것은 플레이위드 종목이다. 플레이위드는 주당 18,150원의 거래가격으로 전일대비+5.22%의 등락률을 기록 소프트웨어 개발 및 게임테마주를..."
974,[MK라씨로] `단식` 황교안 테마주 4% 상승…이낙연株 추월,AI기자가 쓴 이번주 키워드 인공지능(AI) 투자비서 MK라씨로가 바쁜 투자자들을 위해 일주일 동안 투자자들 사이에서 이슈가 됐던 키워드와 관련된 종목들을 분석했다. 플레이스토어에서 내려받을 수 있는 MK라씨로...
975,"[여행/관광 테마주 시황-마감] 롯데관광개발,아시아나항공 등이 상승세 견인중","12월 11일 수요일 여행/관광 테마주 종가를 알아본다. 이 날 여행/관광주를 견인한 것은 롯데관광개발 종목이다. 롯데관광개발은 주당 13,100원의 거래가격으로 전일대비+3.97%의 등락률을 기록 여행/관광테마주를..."
976,"[12일 10시 카지노 테마주 오전 시황] 강원랜드,파라다이스 등이 상승세 견인...","카지노 테마주, 관련 현황을 알아본다. 10시 38분 현재 카지노주를 견인하고 있는 것은 강원랜드 종목이다. 강원랜드는 주당 29,850원의 거래가격으로 전일대비+1.02%의 등락률을 기록 카지노테마주를 주도하고..."
977,"[PCB생산 테마주 시황-마감] 인터플렉스,비에이치 등이 주도","12월 6일 금요일 PCB생산 테마주 종가를 알아본다. 이 날 PCB생산주를 견인한 것은 인터플렉스 종목이다. 인터플렉스는 주당 15,900원의 거래가격으로 전일대비+4.26%의 등락률을 기록 PCB생산테마주를 주도한..."
978,"[9일 10시 플렉서블 디스플레이 테마주 시황-오전] LG디스플레이,상보 등이 주...","12월 9일 월요일 이시간 현재 플렉서블 디스플레이 테마주, 관련 현황을 알아본다. 10시 33분 현재... LG디스플레이는 주당 15,750원의 거래가격으로 전일대비+7.14%의 등락률을 기록 플렉서블 디스플레이테마주를..."
979,"[09시 13분 엔터테인먼트 오전 테마시황] 큐로홀딩스,이에스에이 등이 주도","테마주, 관련 현황을 알아본다. 09시 13분 현재 엔터테인먼트주를 견인하고 있는 것은 큐로홀딩스 종목이다. 큐로홀딩스는 주당 974원의 거래가격으로 전일대비+4.96%의 등락률을 기록 엔터테인먼트테마주를..."
980,"[13시 24분 엔터테인먼트 오후의 테마종목] 큐로홀딩스,이에스에이 등이 주도","테마주, 관련 현황을 알아본다. 13시 24분 현재 엔터테인먼트주를 견인하고 있는 것은 큐로홀딩스 종목이다. 큐로홀딩스는 주당 1,100원의 거래가격으로 전일대비+18.53%의 등락률을 기록 엔터테인먼트테마주를..."
981,"[09시 12분 DMZ 평화공원 오전의 테마종목] 모헨즈,시그네틱스 등이 상승세 견...","평화공원 테마주, 관련 현황을 알아본다. 09시 12분 현재 DMZ 평화공원주를 견인하고 있는 것은 모헨즈 종목이다. 모헨즈는 주당 5,210원의 거래가격으로 전일대비+6.76%의 등락률을 기록 DMZ 평화공원테마주를..."
982,"[09시 12분 전력저장장치(ESS) 오전 테마시황] 삼진엘앤디,LG화학 등이 주도","12월 20일 금요일 이시간 현재 전력저장장치(ESS) 테마주, 관련 현황을 알아본다. 09시 12분 현재... 삼진엘앤디는 주당 2,370원의 거래가격으로 전일대비+12.06%의 등락률을 기록 전력저장장치(ESS)테마주를 주도하고..."
983,"[9일 10시 여행/관광 테마주 시황-오전] 세중,파라다이스 등이 주도","여행/관광 테마주, 관련 현황을 알아본다. 10시 37분 현재 여행/관광주를 견인하고 있는 것은 세중 종목이다. 세중은 주당 2,985원의 거래가격으로 전일대비+1.88%의 등락률을 기록 여행/관광테마주를 주도하고 있는..."
984,"[농업주 테마주 시황-마감] 한탑,동방아그로 등이 주도","12월 9일 월요일 농업주 테마주 종가를 알아본다. 이 날 농업주주를 견인한 것은 한탑 종목이다. 한탑은 주당 1,980원의 거래가격으로 전일대비+1.28%의 등락률을 기록 농업주테마주를 주도한 것으로 알려졌다...."
985,"[09시 16분 백신/진단시약/방역(신종플루, AI 등) 오전의 테마종목] 화일약품...","12월 19일 목요일 이시간 현재 백신/진단시약/방역(신종플루, AI 등) 테마주, 관련 현황을 알아본다. 09시... 68%의 등락률을 기록 백신/진단시약/방역(신종플루, AI 등)테마주를 주도하고 있는 것으로 알려졌다...."
986,"[12/5 중국증시종합] 기술주 반등, 상하이종합지수 0.74%↑","이날 무선이어폰, 화웨이 테마주, 폭스콘 테마주, 애플 테마주 등 기술주들의 주가가 2% 넘게 상승했다. 이와 함께 생체인식, OLED 종목의 주가도 호조를 보였다. 대형주들도 강세를 보였다. 대형주로 구성된..."
987,"[10일 10시 탄소 배출권 테마주 오전 시황] 휴켐스,한솔홈데코 등이 주도...","배출권 테마주, 관련 현황을 알아본다. 10시 39분 현재 탄소 배출권주를 견인하고 있는 것은 휴켐스 종목이다. 휴켐스는 주당 21,750원의 거래가격으로 전일대비+0.93%의 등락률을 기록 탄소 배출권테마주를..."
988,"[13시 25분 보험 테마주 오후 시황] 흥국화재,코리안리 등이 상승세 주도","보험 테마주, 관련 현황을 알아본다. 13시 25분 현재 보험주를 견인하고 있는 것은 흥국화재 종목이다. 흥국화재는 주당 3,150원의 거래가격으로 전일대비+2.61%의 등락률을 기록 보험테마주를 주도하고 있는 것으로..."
989,"[10시 40분 LBS관련주 테마주 시황-오전] 팅크웨어,한양디지텍 등이 주도...","LBS관련주 테마주, 관련 현황을 알아본다. 10시 40분 현재 LBS관련주주를 견인하고 있는 것은 팅크웨어 종목이다. 팅크웨어는 주당 7,120원의 거래가격으로 전일대비보합세의 등락률을 기록 LBS관련주테마주를..."
990,"[13시 25분 보험 테마주 오후 시황] 흥국화재,코리안리 등이 상승세 주도","보험 테마주, 관련 현황을 알아본다. 13시 25분 현재 보험주를 견인하고 있는 것은 흥국화재 종목이다. 흥국화재는 주당 3,150원의 거래가격으로 전일대비+2.61%의 등락률을 기록 보험테마주를 주도하고 있는 것으로..."
991,"[10일 10시 LED산업 테마주 시황-오전] 루미마이크로,빛샘전자 등이 주도...","LED산업 테마주, 관련 현황을 알아본다. 10시 40분 현재 LED산업주를 견인하고 있는 것은 루미마이크로 종목이다. 루미마이크로는 주당 2,465원의 거래가격으로 전일대비+2.71%의 등락률을 기록 LED산업테마주를..."
992,"[10일 13시 풍력에너지 테마주 오후 시황] 씨에스윈드,태웅 등이 상승세 주도","테마주, 관련 현황을 알아본다. 13시 29분 현재 풍력에너지주를 견인하고 있는 것은 씨에스윈드 종목이다. 씨에스윈드는 주당 36,700원의 거래가격으로 전일대비+0.82%의 등락률을 기록 풍력에너지테마주를 주도하고..."
993,"[헬스케어 테마주 시황-마감] 뷰웍스,메타바이오메드 등이 주도","12월 9일 월요일 헬스케어 테마주 종가를 알아본다. 이 날 헬스케어주를 견인한 것은 뷰웍스 종목이다. 뷰웍스는 주당 27,300원의 거래가격으로 전일대비+1.11%의 등락률을 기록 헬스케어테마주를 주도한 것으로..."
994,"[PCB생산 테마주-마감] 이수페타시스,삼성전기 등이 상승세 주도","12월 9일 월요일 PCB생산 테마주 종가를 알아본다. 이 날 PCB생산주를 견인한 것은 이수페타시스 종목이다. 이수페타시스는 주당 3,790원의 거래가격으로 전일대비+2.02%의 등락률을 기록 PCB생산테마주를 주도한..."
995,"[보험 테마주 시황-마감] 흥국화재,한화생명 등이 상승세 견인중","12월 9일 월요일 보험 테마주 종가를 알아본다. 이 날 보험주를 견인한 것은 흥국화재 종목이다. 흥국화재는 주당 3,070원의 거래가격으로 전일대비+2.16%의 등락률을 기록 보험테마주를 주도한 것으로 알려졌다...."
996,"[18일 09시 자원개발 오전의 테마종목] 엔케이물산,넥스트BT 등이 상승세 주도","자원개발 테마주, 관련 현황을 알아본다. 09시 13분 현재 자원개발주를 견인하고 있는 것은 엔케이물산 종목이다. 엔케이물산은 주당 1,510원의 거래가격으로 전일대비+4.14%의 등락률을 기록 자원개발테마주를..."
997,"[10시 38분 스마트폰 부품주 테마주 오전 시황] 모다이노칩,엘비세미콘 등이 ...","테마주, 관련 현황을 알아본다. 10시 38분 현재 스마트폰 부품주주를 견인하고 있는 것은 모다이노칩 종목이다. 모다이노칩은 주당 3,485원의 거래가격으로 전일대비+4.03%의 등락률을 기록 스마트폰 부품주테마주를..."
998,"[10시 33분 NFC 테마주 시황-오전] 한국정보통신,나이스정보통신 등이 상승세...","NFC 테마주, 관련 현황을 알아본다. 10시 33분 현재 NFC주를 견인하고 있는 것은 한국정보통신 종목이다. 한국정보통신은 주당 7,680원의 거래가격으로 전일대비+2.81%의 등락률을 기록 NFC테마주를 주도하고 있는..."
999,"[시스템반도체 테마 마감시황] 에이디테크놀로지,하나마이크론 등이 상승세 주...","시스템반도체 테마주 종가를 알아본다. 이 날 시스템반도체주를 견인한 것은 에이디테크놀로지 종목이다. 에이디테크놀로지는 주당 14,200원의 거래가격으로 전일대비+20.34%의 등락률을 기록 시스템반도체테마주..."
1000,"[시스템반도체 테마 마감시황] 에이디테크놀로지,하나마이크론 등이 상승세 주...","시스템반도체 테마주 종가를 알아본다. 이 날 시스템반도체주를 견인한 것은 에이디테크놀로지 종목이다. 에이디테크놀로지는 주당 14,200원의 거래가격으로 전일대비+20.34%의 등락률을 기록 시스템반도체테마주..."
1001,"[철도 테마종목 종가] 푸른기술,부산산업 등이 주도...","12월 18일 수요일 철도 테마주 종가를 알아본다. 이 날 철도주를 견인한 것은 푸른기술 종목이다. 푸른기술은 주당 17,750원의 거래가격으로 전일대비+7.58%의 등락률을 기록 철도테마주를 주도한 것으로 알려졌다...."
1002,"[여행/관광 테마주 시황-마감] 하나투어,강원랜드 등이 상승세 견인중","12월 12일 목요일 여행/관광 테마주 종가를 알아본다. 이 날 여행/관광주를 견인한 것은 하나투어 종목이다. 하나투어는 주당 48,900원의 거래가격으로 전일대비+1.66%의 등락률을 기록 여행/관광테마주를 주도한..."
1003,"[12일 10시 소프트웨어 개발 및 게임 테마주 시황-오전] 지어소프트,네오위즈...","12월 12일 목요일 이시간 현재 소프트웨어 개발 및 게임 테마주, 관련 현황을 알아본다. 10시 38분 현재... 지어소프트는 주당 4,515원의 거래가격으로 전일대비+4.15%의 등락률을 기록 소프트웨어 개발 및 게임테마주를..."
1004,"[사료 테마주-마감] 팜스토리,케이씨피드 등이 상승세 견인중","12월 10일 화요일 사료 테마주 종가를 알아본다. 이 날 사료주를 견인한 것은 팜스토리 종목이다. 팜스토리는 주당 1,080원의 거래가격으로 전일대비+1.41%의 등락률을 기록 사료테마주를 주도한 것으로 알려졌다...."
1005,"[국내상장 중국기업 테마주 시황-마감] 씨케이에이치,GRT 등이 상승세 주도",중국기업 테마주 종가를 알아본다. 이 날 국내상장 중국기업주를 견인한 것은 씨케이에이치 종목이다. 씨케이에이치는 주당 350원의 거래가격으로 전일대비+1.45%의 등락률을 기록 국내상장 중국기업테마주를...
1006,"[18일 13시 도시가스 오후의 테마종목] 서울가스,예스코홀딩스 등이 상승세 견...","도시가스 테마주, 관련 현황을 알아본다. 13시 28분 현재 도시가스주를 견인하고 있는 것은 서울가스 종목이다. 서울가스는 주당 72,500원의 거래가격으로 전일대비+1.97%의 등락률을 기록 도시가스테마주를 주도하고..."
1007,"[19일 09시 OLED(유기 발광 다이오드) 오전 테마시황] 에스엔텍비엠,AP시스템...","12월 19일 목요일 이시간 현재 OLED(유기 발광 다이오드) 테마주, 관련 현황을 알아본다. 09시 13분 현재... 30%의 등락률을 기록 OLED(유기 발광 다이오드)테마주를 주도하고 있는 것으로 알려졌다...."
1008,"[09시 16분 항공/저가 항공사(LCC) 오전의 테마종목] 제주항공,티웨이항공 등...","12월 19일 목요일 이시간 현재 항공/저가 항공사(LCC) 테마주, 관련 현황을 알아본다. 09시 16분 현재 항공... 제주항공은 주당 28,600원의 거래가격으로 전일대비+3.25%의 등락률을 기록 항공/저가 항공사(LCC)테마주를..."
1009,"[CCTV＆DVR 테마 마감시황] 데일리블록체인,ITX엠투엠 등이 주도...","CCTV＆DVR 테마주 종가를 알아본다. 이 날 CCTV＆DVR주를 견인한 것은 데일리블록체인 종목이다. 데일리블록체인은 주당 1,065원의 거래가격으로 전일대비+11.05%의 등락률을 기록 CCTV＆DVR테마주를 주도한..."
1010,"[모바일게임(스마트폰) 테마 마감시황] 한빛소프트,썸에이지 등이 상승세 견인...","(스마트폰) 테마주 종가를 알아본다. 이 날 모바일게임(스마트폰)주를 견인한 것은 한빛소프트 종목이다. 한빛소프트는 주당 3,385원의 거래가격으로 전일대비+6.78%의 등락률을 기록 모바일게임(스마트폰)테마주를..."
1011,"[19일 09시 시스템반도체 오전 테마시황] SK하이닉스,SFA반도체 등이 주도...","테마주, 관련 현황을 알아본다. 09시 15분 현재 시스템반도체주를 견인하고 있는 것은 SK하이닉스 종목이다. SK하이닉스는 주당 96,000원의 거래가격으로 전일대비+3.23%의 등락률을 기록 시스템반도체테마주를..."
1012,"[09시 12분 반도체 장비 오전의 테마종목] 유니테스트,유진테크 등이 주도...","장비 테마주, 관련 현황을 알아본다. 09시 12분 현재 반도체 장비주를 견인하고 있는 것은 유니테스트 종목이다. 유니테스트는 주당 15,200원의 거래가격으로 전일대비+4.47%의 등락률을 기록 반도체 장비테마주를..."
1013,"[아스콘(아스팔트 콘크리트) 테마종목 종가] 스페코,SG 등이 주도...","콘크리트) 테마주 종가를 알아본다. 이 날 아스콘(아스팔트 콘크리트)주를 견인한 것은 스페코 종목이다. 스페코는 주당 4,165원의 거래가격으로 전일대비+6.52%의 등락률을 기록 아스콘(아스팔트 콘크리트)테마주..."
1014,"[13시 23분 탄소 배출권 테마주 오후 시황] 후성,에코프로 등이 상승세 주도","배출권 테마주, 관련 현황을 알아본다. 13시 23분 현재 탄소 배출권주를 견인하고 있는 것은 후성 종목이다. 후성은 주당 7,760원의 거래가격으로 전일대비+3.47%의 등락률을 기록 탄소 배출권테마주를 주도하고..."
1015,"[13시 25분 제습기 오후 테마시황] 삼성전자,에스피지 등이 상승세 견인중","제습기 테마주, 관련 현황을 알아본다. 13시 25분 현재 제습기주를 견인하고 있는 것은 삼성전자 종목이다. 삼성전자는 주당 56,300원의 거래가격으로 전일대비+2.93%의 등락률을 기록 제습기테마주를 주도하고..."
1016,"[10시 35분 카지노 테마주 시황-오전] 토비스,코텍 등이 주도...","카지노 테마주, 관련 현황을 알아본다. 10시 35분 현재 카지노주를 견인하고 있는 것은 토비스 종목이다. 토비스는 주당 9,000원의 거래가격으로 전일대비+2.62%의 등락률을 기록 카지노테마주를 주도하고 있는..."
1017,"[10시 39분 여행/관광 테마주 오전 시황] 세중,대한항공 등이 상승세 주도","여행/관광 테마주, 관련 현황을 알아본다. 10시 39분 현재 여행/관광주를 견인하고 있는 것은 세중 종목이다. 세중은 주당 3,080원의 거래가격으로 전일대비+1.82%의 등락률을 기록 여행/관광테마주를 주도하고 있는..."
1018,"[10시 36분 원자력발전 테마주 오전 시황] 비엠티,한전기술 등이 주도...","원자력발전 테마주, 관련 현황을 알아본다. 10시 35분 현재 원자력발전주를 견인하고 있는 것은 비엠티 종목이다. 비엠티는 주당 6,570원의 거래가격으로 전일대비+1.86%의 등락률을 기록 원자력발전테마주를..."
1019,"[9일 10시 수산주 테마주 시황-오전] 동원수산,CJ씨푸드 등이 주도...","수산주 테마주, 관련 현황을 알아본다. 10시 37분 현재 수산주주를 견인하고 있는 것은 동원수산 종목이다. 동원수산은 주당 10,300원의 거래가격으로 전일대비+1.48%의 등락률을 기록 수산주테마주를 주도하고..."
1020,"[9일 13시 2차전지 관련주 테마주 시황-오후] 에코프로,상신이디피 등이 주도...","관련주 테마주, 관련 현황을 알아본다. 13시 25분 현재 2차전지 관련주주를 견인하고 있는 것은 에코프로 종목이다. 에코프로는 주당 20,300원의 거래가격으로 전일대비+5.18%의 등락률을 기록 2차전지 관련주테마주..."
1021,"[전선 테마주 시황-마감] 일진전기,LS 등이 상승세 주도","12월 6일 금요일 전선 테마주 종가를 알아본다. 이 날 전선주를 견인한 것은 일진전기 종목이다. 일진전기는 주당 3,375원의 거래가격으로 전일대비+11.39%의 등락률을 기록 전선테마주를 주도한 것으로 알려졌다...."
1022,"[소매유통 테마종목 종가] 아이에스이커머스,현대홈쇼핑 등이 상승세 견인중","소매유통 테마주 종가를 알아본다. 이 날 소매유통주를 견인한 것은 아이에스이커머스 종목이다. 아이에스이커머스는 주당 4,280원의 거래가격으로 전일대비+3.51%의 등락률을 기록 소매유통테마주를 주도한..."
1023,"[제습기 테마종목 종가] 신일산업,위니아딤채 등이 상승세 주도","12월 19일 목요일 제습기 테마주 종가를 알아본다. 이 날 제습기주를 견인한 것은 신일산업 종목이다. 신일산업은 주당 1,760원의 거래가격으로 전일대비+1.73%의 등락률을 기록 제습기테마주를 주도한 것으로..."
